{
 "kode": "rb-k0-026",
 "brand": "ratu-bawang",
 "konsep": "K0",
 "pembuka": "k0-kejadian",
 "pemeran": {
  "utama": "rb-ayu",
  "pendukung": []
 },
 "judul": "Sekarung bawang untuk kedai yang baru buka",
 "caption": "Kedai baru buka, Chef Ayu yakin laris, pemasok grosir minta minimal sekarung. Tiga minggu kemudian hampir setengah karung terbuang. Di Ratu Bawang boleh ecer dulu, grosir nanti: tangan pertama, gratis ongkir se-Jogja, bayar saat sampai. Silakan pesan lewat WhatsApp di profil. #ratubawang #bawangjogja #supplierbawang #horekajogja",
 "adegan": [
  {
   "teks": "Hari pertama kedai buka, sekarung bawang sudah nangkring di pojok dapur.",
   "primitif": "tumpuk",
   "opsi": {
    "prop": "rb-karung-bawang",
    "kartu": "hari pertama buka",
    "tag": "SEKARUNG",
    "pose": "karung-jempol",
    "wajah": [
     "senang"
    ],
    "latar": "rb-latar-dapur-resto"
   }
  },
  {
   "teks": "Chef Ayu, pemilik kedai, juara bawang goreng, dan selalu terlalu yakin.",
   "primitif": "tokoh",
   "opsi": {
    "pose": "foto-jempol",
    "wajah": [
     "yakin"
    ],
    "judul": "Chef Ayu",
    "sub": "pemilik kedai",
    "bintang": true,
    "latar": "rb-latar-dapur-resto",
    "bubble": "pasti laris!"
   }
  },
  {
   "teks": "Yakin laris, ia ambil minimal sekarung dari grosir.",
   "primitif": "meter",
   "opsi": {
    "meter": [
     {
      "judul": "YAKIN LARIS",
      "dari": 0,
      "ke": 100
     },
     {
      "judul": "PELANGGAN KEDAI",
      "dari": 0,
      "ke": 5
     }
    ],
    "pose": "masak",
    "wajah": [
     "yakin",
     "bingung"
    ],
    "tanya": true
   }
  },
  {
   "teks": "Tiga minggu berlalu, tamunya belasan, bukan ratusan.",
   "primitif": "hitung",
   "opsi": {
    "judul": "TAMU 3 MINGGU",
    "dari": 0,
    "ke": 14,
    "format": "angka",
    "pose": "foto-panik",
    "wajah": [
     "kaget"
    ],
    "bubble": "cuma segini?",
    "suasana": "masalah"
   }
  },
  {
   "teks": "Tahu siapa paling menderita?",
   "primitif": "kartu-tanya",
   "opsi": {
    "teks": "Siapa paling menderita?",
    "bayangan": "rb-maskot-karung-kaget"
   }
  },
  {
   "teks": "Iya, aku, karung itu.",
   "primitif": "reveal",
   "opsi": {
    "subjek": "rb-maskot-karung-kaget",
    "label": "KARUNG POJOK",
    "teks": "IYA, AKU!"
   }
  },
  {
   "teks": "Isiku bertunas, keriput, lalu dibuang sedikit-sedikit.",
   "primitif": "derita",
   "opsi": {
    "maskot": "rb-maskot-karung-kaget",
    "label": "KARUNG",
    "item": [
     "BERTUNAS",
     "KERIPUT",
     "DIBUANG"
    ],
    "prop": [
     "rb-bawang-merah"
    ]
   }
  },
  {
   "teks": "Chef Ayu menghitung yang terbuang: hampir setengah karung.",
   "primitif": "tokoh",
   "opsi": {
    "pose": "foto-nangis",
    "wajah": [
     "kesal"
    ],
    "stempel": "TERBUANG",
    "prop": "rb-bawang-merah",
    "latar": "rb-latar-dapur-resto"
   }
  },
  {
   "teks": "Ia pindah ke Ratu Bawang: ecer dulu, grosir nanti.",
   "primitif": "logo",
   "opsi": {
    "stempel": "PINDAH!",
    "pose": "foto-lega-hp",
    "wajah": [
     "lega"
    ]
   }
  },
  {
   "teks": "Tangan pertama, gratis antar, bayar saat sampai.",
   "primitif": "daftar",
   "opsi": {
    "judul": "RATU BAWANG",
    "item": [
     "ecer dulu, grosir nanti",
     "tangan pertama",
     "bayar saat sampai"
    ],
    "stempel": "PAS",
    "suasana": "solusi"
   }
  },
  {
   "teks": "Aku pensiun. Bawang kini datang secukupnya.",
   "primitif": "haru",
   "opsi": {
    "kartu": "bawang datang secukupnya",
    "tag": "PENSIUN",
    "maskot": "rb-maskot-karung-lelah",
    "label": "KARUNG"
   }
  },
  {
   "teks": "Pesan lewat WhatsApp di profil.",
   "primitif": "cta",
   "opsi": {
    "ajakan": "Ecer dulu,\ngrosir nanti",
    "pose": "foto-jempol",
    "wajah": [
     "senang"
    ]
   }
  }
 ],
 "juri": {
  "skor": {
   "logika": 8,
   "pembuka": 6,
   "tokoh": 8,
   "relevansi": 9,
   "humor": 7
  },
  "rata": 7.6,
  "catatan": "Pembuka 'sekarung bawang nangkring' datar dan tidak memancing. Ganti dengan hasil akhir, misalnya 'Tiga minggu, tamu belasan, bawang sekarung bertunas'. Adegan 2 menyebut 'kedai' padahal tokoh dipatok pemilik resto, samakan. Adegan 4 'belasan' perlu angka pembanding.",
  "naskah_hash": "fca99d1ed62b",
  "waktu": "2026-10-30T02:27",
  "model": "claude-sonnet-subagen",
  "mode": "borongan-9"
 }
}
